Index,Start Time,End Time,Start Time (sec),Text,Movie
349,0:32:2,0:32:5,1922,Fool. What do I care what your name is? You're a criminal.,Batman Begins
350,0:32:7,0:32:8,1927,Tell that to the guy who owned these.,Batman Begins
351,0:32:12,0:32:16,1932,You've traveled the world to understand the criminal mind and conquer your fears.,Batman Begins
352,0:32:18,0:32:22,1938,But a criminal is not complicated.,Batman Begins
353,0:32:22,0:32:25,1942,And what you really fear is inside yourself.,Batman Begins
354,0:32:25,0:32:28,1945,You fear your own power.,Batman Begins
355,0:32:28,0:32:29,1948,You fear your anger...,Batman Begins
356,0:32:30,0:32:34,1950,...the drive to do great or terrible things.,Batman Begins
357,0:32:34,0:32:38,1954,Now you must journey inwards.,Batman Begins
358,0:32:42,0:32:44,1962,You are ready.,Batman Begins
359,0:32:45,0:32:46,1965,Breathe.,Batman Begins
360,0:32:56,0:32:58,1976,Breathe.,Batman Begins
361,0:33:3,0:33:4,1983,Breathe in your fears.,Batman Begins
362,0:33:7,0:33:8,1987,Face them.,Batman Begins
363,0:33:10,0:33:12,1990,"To conquer fear, you must become fear.",Batman Begins
364,0:33:12,0:33:16,1992,You must bask in the fear of other men.,Batman Begins
365,0:33:17,0:33:21,1997,And men fear most what they cannot see.,Batman Begins
366,0:33:38,0:33:41,2018,You have to become a terrible thought.,Batman Begins
367,0:33:45,0:33:47,2025,A wraith.,Batman Begins
368,0:33:52,0:33:55,2032,You have to become an idea!,Batman Begins
369,0:34:2,0:34:5,2042,Feel terror cloud your senses.,Batman Begins
370,0:34:6,0:34:10,2046,Feel its power to distort.,Batman Begins
371,0:34:11,0:34:13,2051,To control.,Batman Begins
372,0:34:16,0:34:20,2056,And know that this power can be yours.,Batman Begins
373,0:34:32,0:34:35,2072,Embrace your worst fear.,Batman Begins
374,0:34:42,0:34:44,2082,Become one with the darkness.,Batman Begins
375,0:35:4,0:35:6,2104,Focus.,Batman Begins
376,0:35:6,0:35:8,2106,Concentrate.,Batman Begins
377,0:35:8,0:35:10,2108,Master your senses.,Batman Begins
378,0:35:39,0:35:41,2139,You cannot leave any sign.,Batman Begins
379,0:35:41,0:35:43,2141,I haven't.,Batman Begins
380,0:35:51,0:35:53,2151,Impressive.,Batman Begins
381,0:36:2,0:36:4,2162,We have purged your fear.,Batman Begins
382,0:36:5,0:36:7,2165,You are ready to lead these men.,Batman Begins
383,0:36:7,0:36:11,2167,You are ready to become a member of the League of Shadows.,Batman Begins
384,0:36:13,0:36:17,2173,"But first, you must demonstrate your commitment to justice.",Batman Begins
385,0:36:34,0:36:35,2194,No.,Batman Begins
386,0:36:37,0:36:38,2197,I'm no executioner.,Batman Begins
387,0:36:39,0:36:42,2199,Your compassion is a weakness your enemies will not share.,Batman Begins
388,0:36:43,0:36:45,2203,That's why it's so important.,Batman Begins
389,0:36:45,0:36:47,2205,It separates us from them.,Batman Begins
390,0:36:47,0:36:50,2207,You want to fight criminals. This man is a murderer.,Batman Begins
391,0:36:50,0:36:52,2210, This man should be tried.  By whom?,Batman Begins
392,0:36:52,0:36:53,2212,Corrupt bureaucrats?,Batman Begins
393,0:36:54,0:36:56,2214,Criminals mock society's laws.,Batman Begins
394,0:36:56,0:36:59,2216,You know this better than most.,Batman Begins
395,0:36:59,0:37:2,2219,You cannot lead these men...,Batman Begins
396,0:37:2,0:37:6,2222,...unless you are prepared to do what is necessary to defeat evil.,Batman Begins
397,0:37:7,0:37:9,2227,And where would I be leading these men?,Batman Begins
398,0:37:10,0:37:11,2230,Gotham.,Batman Begins
399,0:37:11,0:37:13,2231,As Gotham's favored son...,Batman Begins
400,0:37:13,0:37:18,2233,...you will be ideally placed to strike at the heart of criminality.,Batman Begins
401,0:37:18,0:37:22,2238, How?  Gotham's time has come.,Batman Begins
402,0:37:22,0:37:25,2242,Like Constantinople or Rome before it...,Batman Begins
403,0:37:26,0:37:30,2246,...the city has become a breeding ground for suffering and injustice.,Batman Begins
404,0:37:30,0:37:34,2250,It is beyond saving and must be allowed to die.,Batman Begins
405,0:37:34,0:37:39,2254,This is the most important function of the League of Shadows.,Batman Begins
406,0:37:39,0:37:42,2259,It is one we've performed for centuries.,Batman Begins
407,0:37:43,0:37:44,2263,Gotham...,Batman Begins
408,0:37:45,0:37:47,2265,...must be destroyed.,Batman Begins
409,0:37:51,0:37:52,2271,You can't believe in this.,Batman Begins
410,0:37:53,0:37:57,2273,Ra's al Ghul rescued us from the darkest corners of our own hearts.,Batman Begins
411,0:37:57,0:38:2,2277,What he asks in return is the courage to do what is necessary.,Batman Begins
412,0:38:2,0:38:5,2282,I will go back to Gotham and I will fight men like this...,Batman Begins
413,0:38:5,0:38:8,2285,...but I will not become an executioner.,Batman Begins
414,0:38:8,0:38:10,2288,"Bruce, please.",Batman Begins
415,0:38:10,0:38:13,2290,"For your own sake, there is no turning back.",Batman Begins
416,0:38:45,0:38:48,2325," What are you doing?  What's necessary, my friend.",Batman Begins
417,0:41:4,0:41:7,2464,I will tell him you saved his life.,Batman Begins
418,0:41:26,0:41:28,2486,"Master Wayne, you've been gone a long time.",Batman Begins
419,0:41:29,0:41:31,2489," Yes, I have.  You look very fashionable.",Batman Begins
420,0:41:32,0:41:34,2492,Apart from the mud.,Batman Begins
421,0:41:34,0:41:37,2494,"Are you coming back to Gotham for long, sir?",Batman Begins
422,0:41:37,0:41:38,2497,As long as it takes.,Batman Begins
423,0:41:38,0:41:40,2498,I want to show the people...,Batman Begins
424,0:41:40,0:41:43,2500,...their city doesn't belong to the criminals and the corrupt.,Batman Begins
425,0:41:44,0:41:47,2504,"In the depression, your father nearly bankrupted Wayne Enterprises...",Batman Begins
426,0:41:47,0:41:48,2507,...combating poverty.,Batman Begins
427,0:41:48,0:41:53,2508,He believed his example could inspire the wealthy of Gotham to save their city.,Batman Begins
428,0:41:53,0:41:55,2513,Did it?,Batman Begins
429,0:41:56,0:41:57,2516,In a way.,Batman Begins
430,0:41:58,0:42:1,2518,Their murder shocked the wealthy and the powerful into action.,Batman Begins
431,0:42:3,0:42:6,2523,People need dramatic examples to shake them out of apathy.,Batman Begins
432,0:42:6,0:42:8,2526,I can't do that as Bruce Wayne.,Batman Begins
433,0:42:8,0:42:9,2528,As a man...,Batman Begins
434,0:42:9,0:42:12,2529,"...I'm flesh and blood, I can be ignored, destroyed.",Batman Begins
435,0:42:12,0:42:14,2532,But as a symbol...,Batman Begins
436,0:42:15,0:42:18,2535,"As a symbol, I can be incorruptible.",Batman Begins
437,0:42:18,0:42:21,2538, I can be everlasting.  What symbol?,Batman Begins
438,0:42:21,0:42:24,2541,Something elemental...,Batman Begins
439,0:42:24,0:42:26,2544,...something terrifying.,Batman Begins
440,0:42:26,0:42:28,2546,I assume that as you take on the underworld...,Batman Begins
441,0:42:28,0:42:34,2548,...this symbol is a persona to protect those you care about from reprisals?,Batman Begins
442,0:42:34,0:42:35,2554,You're thinking about Rachel?,Batman Begins
443,0:42:35,0:42:38,2555,"Actually, sir, I was thinking of myself.",Batman Begins
444,0:42:40,0:42:41,2560,Have you told anyone I'm coming back?,Batman Begins
445,0:42:42,0:42:46,2562,I couldn't figure the legal ramifications of bringing you back from the dead.,Batman Begins
446,0:42:46,0:42:48,2566, Dead?  You've been gone seven years.,Batman Begins
447,0:42:48,0:42:49,2568,You had me declared dead?,Batman Begins
448,0:42:49,0:42:52,2569,"Actually, it was Mr. Earle. He's taking the company public.",Batman Begins
449,0:42:52,0:42:55,2572,He wanted to liquidate your majority shareholding.,Batman Begins
450,0:42:55,0:42:57,2575,Those shares are worth quite a bit of money.,Batman Begins
451,0:42:57,0:43:0,2577,"Well, it's a good thing I left everything to you, then.",Batman Begins
452,0:43:1,0:43:2,2581,"Quite so, sir.",Batman Begins
453,0:43:2,0:43:6,2582,"And you can borrow the Rolls, if you like. Just bring it back with a full tank.",Batman Begins
454,0:43:16,0:43:21,2596,"In my opinion, Mr. Zsaz is as much a danger to himself as to others...",Batman Begins
455,0:43:21,0:43:26,2601,...and prison is probably not the best environment for his rehabilitation.,Batman Begins
456,0:43:28,0:43:31,2608, Dr. Crane.  Miss Dawes.,Batman Begins
457,0:43:31,0:43:34,2611,You think a man who butchers people for the mob doesn't belong in jail?,Batman Begins
458,0:43:34,0:43:37,2614,"I would hardly have testified to that otherwise, would I?",Batman Begins
459,0:43:37,0:43:40,2617,This is the third of Falcone's thugs you've had declared insane...,Batman Begins
460,0:43:41,0:43:42,2621,...and moved into your asylum.,Batman Begins
461,0:43:42,0:43:47,2622,The work offered by organized crime must have an attraction to the insane.,Batman Begins
462,0:43:48,0:43:50,2628,Or the corrupt.,Batman Begins
463,0:43:53,0:43:54,2633,Mr. Finch.,Batman Begins
464,0:43:55,0:43:56,2635,You should check with Miss Dawes here...,Batman Begins
465,0:43:57,0:44:1,2637,...just what implications your office has authorized her to make. If any.,Batman Begins
466,0:44:5,0:44:7,2645," What are you doing?  What are you doing, Carl?",Batman Begins
467,0:44:7,0:44:9,2647,Looking out for you.,Batman Begins
468,0:44:11,0:44:14,2651,Falcone has half the city bought and paid for.,Batman Begins
469,0:44:14,0:44:16,2654, Drop it.  How can you say that?,Batman Begins
470,0:44:17,0:44:20,2657,"Because as much as I care about getting Falcone, I care more about you.",Batman Begins
471,0:44:20,0:44:22,2660,That's sweet.,Batman Begins
472,0:44:27,0:44:30,2667,We've been through all that.,Batman Begins
473,0:44:56,0:44:57,2696,"Blessed bat again, sir.",Batman Begins
474,0:44:57,0:45:0,2697,They nest somewhere in the grounds.,Batman Begins
475,0:46:58,0:47:0,2818,No more favors. Someone is sniffing around.,Batman Begins
476,0:47:1,0:47:4,2821,"Hey, I scratch your back, you scratch mine, doc.",Batman Begins
477,0:47:4,0:47:5,2824,I'm bringing in the shipments.,Batman Begins
478,0:47:6,0:47:7,2826,We are paying you for that.,Batman Begins
479,0:47:7,0:47:10,2827,Maybe money isn't as interesting to me as favors.,Batman Begins
480,0:47:12,0:47:17,2832,"I am more than aware that you are not intimidated by me, Mr. Falcone.",Batman Begins
481,0:47:17,0:47:20,2837,"But you know who I'm working for, and when he gets here...",Batman Begins
482,0:47:20,0:47:22,2840,He... He's coming to Gotham?,Batman Begins
483,0:47:23,0:47:24,2843,"Yes, he is.",Batman Begins
484,0:47:24,0:47:27,2844,"And when he gets here, he's not going to wanna hear...",Batman Begins
485,0:47:27,0:47:32,2847,...that you've endangered our operation just to get your thugs out of jail time.,Batman Begins
486,0:47:33,0:47:36,2853, Who's bothering you?  There's a girl at the DA's office.,Batman Begins
487,0:47:37,0:47:39,2857, We'll buy her off.  Not this one.,Batman Begins
488,0:47:40,0:47:42,2860,"Idealist, huh?",Batman Begins
489,0:47:42,0:47:43,2862,"Well, there's an answer to that too.",Batman Begins
490,0:47:44,0:47:47,2864," I don't want to know.  Yes, you do.",Batman Begins
491,0:47:51,0:47:54,2871,"No, we are showing very healthy growth in these sectors.",Batman Begins
492,0:47:55,0:47:58,2875,I don't think Thomas Wayne would have viewed heavyarms manufacture...,Batman Begins
493,0:47:58,0:48:0,2878,...as a suitable cornerstone for our business.,Batman Begins
494,0:48:1,0:48:5,2881,"Well, that's 20 years ago, Fredericks.",Batman Begins
495,0:48:6,0:48:9,2886,I think after 20 years we can allow ourselves...,Batman Begins
496,0:48:9,0:48:12,2889,...to stop thinking about what Thomas Wayne would have done.,Batman Begins
497,0:48:12,0:48:14,2892,"Good morning, Mr. Earle's office.",Batman Begins
498,0:48:14,0:48:17,2894,"Yes, he's confirmed for the dinner tomorrow evening.",Batman Begins
499,0:48:17,0:48:21,2897,Good morning. I'm here to see Mr. Earle.,Batman Begins
500,0:48:21,0:48:22,2901,Name?,Batman Begins
501,0:48:23,0:48:25,2903,Bruce Wayne.,Batman Begins
502,0:48:26,0:48:30,2906,Thomas would probably not have taken the company public.,Batman Begins
503,0:48:30,0:48:34,2910,"But that is what we, as responsible managers, are going to do.",Batman Begins
504,0:48:35,0:48:36,2915,Jessica?,Batman Begins
505,0:48:38,0:48:40,2918,Jessica? Where are you?,Batman Begins
506,0:48:40,0:48:45,2920," Eye on the ball, and...  Why is no one answering the phone?",Batman Begins
507,0:48:45,0:48:48,2925,"It's Wayne Enterprises, Mr. Earle. I'm sure they'll call back.",Batman Begins
508,0:48:49,0:48:51,2929,Bruce? You're supposed to be dead.,Batman Begins
509,0:48:51,0:48:53,2931,I'm sorry to disappoint.,Batman Begins
510,0:48:53,0:48:56,2933, I need you to take a look at this.  Have you seen him yet?,Batman Begins
511,0:48:56,0:48:58,2936, Who?  Wayne.,Batman Begins
512,0:48:58,0:49:0,2938,It's been all over the news. He's back.,Batman Begins
513,0:49:4,0:49:7,2944,I'm sure you realize I can't stop the big machine.,Batman Begins
514,0:49:7,0:49:9,2947,Too many wheels turning.,Batman Begins
515,0:49:9,0:49:11,2949, We're going public.  I understand.,Batman Begins
516,0:49:11,0:49:14,2951,And I'll be handsomely rewarded for my shares.,Batman Begins
517,0:49:14,0:49:17,2954,I'm not looking to interfere.,Batman Begins
518,0:49:17,0:49:19,2957, I am looking for a job.  Oh?,Batman Begins
519,0:49:20,0:49:23,2960,I just want to get to know the company that my family built.,Batman Begins
520,0:49:23,0:49:25,2963,Any ideas where you would start?,Batman Begins
521,0:49:25,0:49:28,2965,Applied Sciences caught my eye.,Batman Begins
522,0:49:28,0:49:30,2968,Fox's department.,Batman Begins
523,0:49:30,0:49:32,2970,I'll let him know you're coming.,Batman Begins
524,0:49:33,0:49:36,2973,You look like him. Your dad.,Batman Begins
525,0:49:36,0:49:39,2976,You're the only one left of the Wayne family.,Batman Begins
526,0:49:39,0:49:43,2979,This is where you belong. Welcome home.,Batman Begins
527,0:49:43,0:49:48,2983,"Environmental procedures, defense projects, consumer products.",Batman Begins
528,0:49:48,0:49:51,2988,All prototypes. None in production.,Batman Begins
529,0:49:51,0:49:54,2991, On any level whatsoever.  None?,Batman Begins
530,0:49:55,0:49:57,2995,What did they tell you this place was?,Batman Begins
531,0:49:57,0:49:59,2997,They didn't tell me anything.,Batman Begins
532,0:50:2,0:50:5,3002,Earle told me exactly what it was when he sent me down here.,Batman Begins
533,0:50:5,0:50:7,3005,Dead end.,Batman Begins
534,0:50:7,0:50:10,3007,Place to keep me from causing the board any more trouble.,Batman Begins
535,0:50:11,0:50:13,3011,Come on.,Batman Begins
536,0:50:13,0:50:16,3013, You were on the board?  When your father ran things.,Batman Begins
537,0:50:16,0:50:18,3016," You knew my father?  Oh, yeah.",Batman Begins
538,0:50:18,0:50:19,3018,Helped him build his train.,Batman Begins
539,0:50:20,0:50:22,3020,Here we are.,Batman Begins
540,0:50:25,0:50:27,3025,Kevlar utility harness.,Batman Begins
541,0:50:27,0:50:29,3027,"Gaspowered, magnetic grapple gun.",Batman Begins
542,0:50:29,0:50:32,3029,The 350pound test monofilament.,Batman Begins
543,0:50:35,0:50:37,3035,"Wonderful project, your dad's train.",Batman Begins
544,0:50:38,0:50:42,3038,"Routed it right into Wayne Tower, along with the water and power utilities.",Batman Begins
545,0:50:43,0:50:46,3043,Kind of made Wayne Tower the unofficial center of Gotham City.,Batman Begins
546,0:50:46,0:50:49,3046,"Of course, Earle let it go to rot. Here we are.",Batman Begins
547,0:50:50,0:50:53,3050,Nomex survival suit for advanced infantry.,Batman Begins
548,0:50:53,0:50:56,3053,"Kevlar biweave, reinforced joints.",Batman Begins
549,0:50:56,0:50:58,3056, Tearresistant?  This sucker will stop a knife.,Batman Begins
550,0:50:58,0:51:1,3058, Bulletproof?  Anything but a straight shot.,Batman Begins
551,0:51:1,0:51:4,3061, Why didn't they put it into production?  Bean counters didn't think...,Batman Begins
552,0:51:4,0:51:6,3064,...a soldier's life was worth 300 grand.,Batman Begins
553,0:51:7,0:51:11,3067,"So, what's your interest in it, Mr. Wayne?",Batman Begins
554,0:51:11,0:51:13,3071,I want to borrow it.,Batman Begins
555,0:51:13,0:51:15,3073,For spelunking.,Batman Begins
556,0:51:16,0:51:17,3076,Spelunking?,Batman Begins
557,0:51:17,0:51:19,3077,"Yeah, you know, cave diving?",Batman Begins
558,0:51:20,0:51:23,3080,You expecting to run into much gunfire in these caves?,Batman Begins
559,0:51:25,0:51:29,3085,"Look, I'd rather Mr. Earle didn't know about me borrowing...",Batman Begins
560,0:51:29,0:51:30,3089,Mr. Wayne...,Batman Begins
561,0:51:30,0:51:32,3090,...the way I see it...,Batman Begins
562,0:51:33,0:51:35,3093,...all this stuff is yours anyway.,Batman Begins
563,0:51:38,0:51:40,3098,Okay. Give it a try.,Batman Begins
564,0:51:45,0:51:46,3105,Charming.,Batman Begins
565,0:51:49,0:51:50,3109,At least you'll have company.,Batman Begins
566,0:51:52,0:51:56,3112,This must be the lowest foundation of the southeast wing.,Batman Begins
567,0:52:9,0:52:13,3129,Your greatgreatgrandfather was involved in the Underground Railroad...,Batman Begins
568,0:52:13,0:52:16,3133,...secretly transporting freed slaves to the North...,Batman Begins
569,0:52:16,0:52:20,3136,...and I suspect these caverns came in handy.,Batman Begins
570,0:52:33,0:52:35,3153,Alfred! Come up here!,Batman Begins
571,0:52:35,0:52:38,3155,"I can see everything all right from down here, sir, thank you.",Batman Begins
572,0:52:58,0:53:1,3178,We order the main part of this cowl from Singapore.,Batman Begins
573,0:53:1,0:53:2,3181,Via a dummy corporation.,Batman Begins
574,0:53:3,0:53:4,3183,"Indeed. And then, quite separately...",Batman Begins
575,0:53:5,0:53:10,3185,...we place an order to a Chinese company for these.,Batman Begins
576,0:53:10,0:53:13,3190, Put it together ourselves.  Precisely.,Batman Begins
577,0:53:13,0:53:17,3193,"They'll have to be large orders, to avoid suspicion.",Batman Begins
578,0:53:17,0:53:20,3197," How large?  Say 10,000.",Batman Begins
579,0:53:22,0:53:25,3202," Well, at least we'll have spares.  Yes.",Batman Begins
580,0:53:42,0:53:45,3222,Don't suppose you want a taste.,Batman Begins
581,0:53:45,0:53:48,3225,"I just keep offering, thinking maybe someday you'll get wise.",Batman Begins
582,0:53:48,0:53:50,3228,"There's nothing wise in what you do, Flass.",Batman Begins
583,0:53:50,0:53:54,3230,"Well, Jimbo, you don't take the taste, makes us guys nervous.",Batman Begins
584,0:53:54,0:53:56,3234,I'm no rat.,Batman Begins
585,0:53:59,0:54:2,3239,"In a town this bent, who's there to rat to anyway?",Batman Begins
586,0:54:32,0:54:34,3272,Don't turn around.,Batman Begins
587,0:54:35,0:54:38,3275,You're a good cop. One of the few.,Batman Begins
588,0:54:38,0:54:40,3278,What do you want?,Batman Begins
589,0:54:40,0:54:43,3280,Carmine Falcone brings in shipments of drugs every week.,Batman Begins
590,0:54:43,0:54:45,3283,Nobody takes him down. Why?,Batman Begins
591,0:54:46,0:54:48,3286,He's paid up with the right people.,Batman Begins
592,0:54:49,0:54:51,3289,What will it take to bring him down?,Batman Begins
593,0:54:52,0:54:55,3292,Leverage on Judge Faden...,Batman Begins
594,0:54:55,0:54:58,3295,...and a DA brave enough to prosecute.,Batman Begins
595,0:54:58,0:55:0,3298,Rachel Dawes.,Batman Begins
596,0:55:0,0:55:1,3300,Who are you?,Batman Begins
597,0:55:2,0:55:3,3302,Watch for my sign.,Batman Begins
598,0:55:6,0:55:8,3306,You're just one man?,Batman Begins
599,0:55:9,0:55:10,3309,Now we're two.,Batman Begins
600,0:55:12,0:55:14,3312,We?,Batman Begins
601,0:55:29,0:55:31,3329,Freeze!,Batman Begins
602,0:55:48,0:55:50,3348,What the hell was that?,Batman Begins
603,0:55:53,0:55:54,3353,Just some nut.,Batman Begins
604,0:55:58,0:56:1,3358,"Well, what is it today? More spelunking?",Batman Begins
605,0:56:1,0:56:3,3361,No. Today it's BASEjumping.,Batman Begins
606,0:56:4,0:56:5,3364,BASEjumping.,Batman Begins
607,0:56:6,0:56:9,3366, That like parachuting?  Kind of.,Batman Begins
608,0:56:10,0:56:13,3370,Do you have any lightweight fabrics?,Batman Begins
609,0:56:13,0:56:15,3373,"You know, I think I have just the thing.",Batman Begins
610,0:56:17,0:56:19,3377,It's called memory cloth. Notice anything?,Batman Begins
611,0:56:23,0:56:24,3383,Regularly flexible...,Batman Begins
612,0:56:25,0:56:27,3385,...but put a current through it...,Batman Begins
613,0:56:28,0:56:32,3388,"...molecules realign, it becomes rigid.  What kind of shapes can you make?",Batman Begins
614,0:56:32,0:56:35,3392,Can be tailored to fit any structure based on a rigid skeleton.,Batman Begins
615,0:56:36,0:56:37,3396,Too expensive for the Army?,Batman Begins
616,0:56:37,0:56:42,3397,"I don't think they tried to market it to the billionaire, BASEjumping crowd.",Batman Begins
617,0:56:42,0:56:44,3402," Look, Mr. Fox.  Yes, sir?",Batman Begins
618,0:56:44,0:56:46,3404,If you're uncomfortable...,Batman Begins
619,0:56:46,0:56:49,3406,"Mr. Wayne, if you don't want to tell me exactly what you're doing...",Batman Begins
620,0:56:49,0:56:51,3409,"...when I'm asked, I don't have to lie.",Batman Begins
621,0:56:53,0:56:56,3413,But don't think of me as an idiot.,Batman Begins
622,0:56:57,0:56:59,3417,Fair enough.,Batman Begins
623,0:57:1,0:57:3,3421,What's that?,Batman Begins
624,0:57:5,0:57:7,3425,The Tumbler?,Batman Begins
625,0:57:7,0:57:9,3427,"Oh, you wouldn't be interested in that.",Batman Begins
626,0:57:15,0:57:17,3435,She was built as a bridging vehicle.,Batman Begins
627,0:57:19,0:57:24,3439,"During combat, two of these would jump over a river, towing cables.",Batman Begins
628,0:57:26,0:57:30,3446,"Over here on the throttle, flip that open and throttle up.",Batman Begins
629,0:57:30,0:57:33,3450,This will boost you into a rampless jump... Not now!,Batman Begins
630,0:57:35,0:57:37,3455,"Not... Not now, sir.",Batman Begins
631,0:57:40,0:57:42,3460,Afterburner disengaged.,Batman Begins
632,0:57:43,0:57:46,3463,We never could get the damn bridge to work...,Batman Begins
633,0:57:46,0:57:48,3466,...but this baby works just fine.,Batman Begins
634,0:57:57,0:57:58,3477,"So, what do you think?",Batman Begins
635,0:58:0,0:58:2,3480,Does it come in black?,Batman Begins
636,0:58:2,0:58:5,3482,I need you at the docks Thursday.,Batman Begins
637,0:58:5,0:58:7,3485, Problems?  I don't want any trouble...,Batman Begins
638,0:58:7,0:58:9,3487,...with the last shipment.  Sure.,Batman Begins
639,0:58:11,0:58:14,3491,Word on the street is you got a beef with somebody in the DA's office.,Batman Begins
640,0:58:14,0:58:17,3494, Is that right?  And that there's a fat prize...,Batman Begins
641,0:58:17,0:58:20,3497,...waiting for anybody willing to do anything about it.,Batman Begins
642,0:58:20,0:58:22,3500,"So, what's your point, Mr. Flass?",Batman Begins
643,0:58:22,0:58:24,3502,Have you seen the girl?,Batman Begins
644,0:58:24,0:58:27,3504,It's a cute little assistant D A.,Batman Begins
645,0:58:27,0:58:31,3507,"Don 't you think that's a little too much heat to bring down, maybe?",Batman Begins
646,0:58:31,0:58:34,3511, Even for this town.  Never underestimate Gotham City.,Batman Begins
647,0:58:34,0:58:37,3514,People get mugged coming home from work every day of the week.,Batman Begins
648,0:58:37,0:58:40,3517,Sometimes... Sometimes things just go bad.,Batman Begins
649,0:58:44,0:58:46,3524,"It's a problem with the graphite, sir.",Batman Begins
650,0:58:46,0:58:48,3526,"The next 10,000 will be up to specifications.",Batman Begins
651,0:58:49,0:58:51,3529, At least they gave us a discount.  Quite.,Batman Begins
652,0:58:51,0:58:57,3531,"In the meantime, sir, may I suggest you try to avoid landing on your head?",Batman Begins
653,0:59:34,0:59:36,3574,"Why bats, Master Wayne?",Batman Begins
654,0:59:36,0:59:37,3576,Bats frighten me.,Batman Begins
655,0:59:39,0:59:41,3579,It's time my enemies shared my dread.,Batman Begins
656,1:0:8,1:0:10,3608,What is this?,Batman Begins
657,1:0:13,1:0:15,3613,Continue.,Batman Begins
658,1:0:20,1:0:22,3620,Looks fine out there.,Batman Begins
659,1:0:22,1:0:24,3622,The bears go straight to the dealers.,Batman Begins
660,1:0:24,1:0:27,3624,"Yeah, and the rabbits go to the man in the Narrows.",Batman Begins
661,1:0:27,1:0:30,3627," What's the difference?  Ignorance is bliss, my friend.",Batman Begins
662,1:0:31,1:0:34,3631,Don't burden yourself with the secrets of scary people.,Batman Begins
663,1:0:50,1:0:53,3650,Hey. Steiss.,Batman Begins
664,1:1:14,1:1:15,3674,Steiss?,Batman Begins
665,1:1:27,1:1:29,3687,What?,Batman Begins
666,1:1:30,1:1:31,3690,What the...?,Batman Begins
667,1:1:40,1:1:42,3700,I better check it.,Batman Begins
668,1:1:54,1:1:56,3714,There's a problem out here. You better bail.,Batman Begins
669,1:2:26,1:2:27,3746,Where are you?!,Batman Begins
670,1:2:28,1:2:29,3748,Here.,Batman Begins
671,1:2:50,1:2:53,3770,"Get going. Oh, shit.",Batman Begins
672,1:3:11,1:3:13,3791,What the hell are you?,Batman Begins
673,1:3:16,1:3:18,3796,I'm Batman.,Batman Begins
674,1:3:26,1:3:28,3806,Nice coat.,Batman Begins
675,1:3:30,1:3:31,3810,Thanks.,Batman Begins
676,1:4:12,1:4:13,3852,Hold it.,Batman Begins
677,1:4:15,1:4:18,3855,"That's right, you better run.",Batman Begins
678,1:4:27,1:4:29,3867,Falcone sent them to kill you.,Batman Begins
679,1:4:30,1:4:32,3870, Why?  You rattled his cage.,Batman Begins
680,1:4:36,1:4:38,3876, What's this?  Leverage.,Batman Begins
681,1:4:38,1:4:40,3878, For what?  To get things moving.,Batman Begins
682,1:4:40,1:4:42,3880,Who are you?,Batman Begins
683,1:4:42,1:4:44,3882,Someone like you.,Batman Begins
684,1:4:44,1:4:46,3884,Someone who'll rattle the cages.,Batman Begins
685,1:4:51,1:4:54,3891,Ma'am? Everything okay?,Batman Begins
686,1:4:59,1:5:1,3899, Falcone's men?  Does it matter?,Batman Begins
687,1:5:1,1:5:4,3901,We'll never tie him to it anyway.,Batman Begins
688,1:5:4,1:5:6,3904,I wouldn't be too sure of that.,Batman Begins
689,1:5:19,1:5:21,3919,What the hell is that?,Batman Begins
690,1:5:30,1:5:32,3930,Cut him down.,Batman Begins
