Index,Start Time,End Time,Start Time (sec),Text,Movie
316,0:47:7,0:47:12,2827,"They go around the block, they come back, they go around again.",The Truman Show
317,0:47:12,0:47:17,2832, I invited Marlon to barbecue...  I won't be here.,The Truman Show
318,0:47:17,0:47:20,2837,We need more charcoal.,The Truman Show
319,0:47:20,0:47:24,2840,Are you listening to a word I'm saying?,The Truman Show
320,0:47:25,0:47:28,2845,You're upset because you want to go to Fiji?,The Truman Show
321,0:47:30,0:47:31,2850,"Okay, go.",The Truman Show
322,0:47:34,0:47:39,2854,"I think you should save for a few months, and then go.",The Truman Show
323,0:47:39,0:47:42,2859,I'm going to take a shower.,The Truman Show
324,0:47:46,0:47:49,2866,Let's go now. I'm ready. Why wait?,The Truman Show
325,0:47:49,0:47:54,2869,"Early bird gathers no moss, rolling stone catches the worm.",The Truman Show
326,0:47:54,0:47:58,2874,"Truman, what are you doing?",The Truman Show
327,0:48:1,0:48:7,2881, Truman...  Where shall we go?,The Truman Show
328,0:48:8,0:48:13,2888," Truman, where are we going?  I guess I'm being spontaneous.",The Truman Show
329,0:48:13,0:48:17,2893,Somebody help me! I'm being spontaneous!,The Truman Show
330,0:48:18,0:48:23,2898,"Forget Fiji. We can't drive to Fiji, can we?",The Truman Show
331,0:48:24,0:48:28,2904," What about Atlantic City.  No, you hate to gamble.",The Truman Show
332,0:48:29,0:48:33,2909,"That's right, I do. But I never have.",The Truman Show
333,0:48:33,0:48:36,2913,And that's why people go places.,The Truman Show
334,0:48:36,0:48:40,2916," I think I'm going to throw up.  Me, too.",The Truman Show
335,0:48:49,0:48:54,2929,"Blocked at every turn. Beautifully synchronized, don't you think?",The Truman Show
336,0:48:54,0:48:58,2934, You're blaming me for the traffic?  Should I?,The Truman Show
337,0:49:4,0:49:8,2944,"Truman, let's go home.",The Truman Show
338,0:49:8,0:49:12,2948,You're right. We could be stuck here for hours.,The Truman Show
339,0:49:12,0:49:17,2952,It'll be like this all the way to Atlantic City. Let's go back.,The Truman Show
340,0:49:17,0:49:21,2957,I'm sorry. I don't know what got into me.,The Truman Show
341,0:49:23,0:49:28,2963," Can you please slow down?  Yes, I can.",The Truman Show
342,0:49:30,0:49:33,2970, That's our turnoff.  I changed my mind.,The Truman Show
343,0:49:33,0:49:37,2973,What's New Orleans like this time of year? Mardis Gras!,The Truman Show
344,0:49:43,0:49:49,2983,"Look, Meryl. Same road, no cars. It's magic.",The Truman Show
345,0:49:49,0:49:54,2989,"Let me out. If you want to destroy yourself, do it on your own.",The Truman Show
346,0:49:54,0:49:58,2994,I think I'd like a little company.,The Truman Show
347,0:50:3,0:50:8,3003,"Oh, Truman... You knew this would happen.",The Truman Show
348,0:50:8,0:50:11,3008,You know you can't drive over water.,The Truman Show
349,0:50:11,0:50:16,3011,"Let's go home, where you'll feel safe.",The Truman Show
350,0:50:17,0:50:20,3017,Give me your hand... You drive!,The Truman Show
351,0:50:21,0:50:26,3021,We shouldn't be doing this. We're breaking the law!,The Truman Show
352,0:50:26,0:50:31,3026," Oh, my!  You can do it! You can make it!",The Truman Show
353,0:50:32,0:50:36,3032,We're over! We're over the bridge!,The Truman Show
354,0:50:37,0:50:40,3037, We're over the bridge!  We're over!,The Truman Show
355,0:50:44,0:50:46,3044,FOREST FIRE WARNING EXTREME DANGER,The Truman Show
356,0:50:46,0:50:50,3046, What about that sign?  They exaggerate. We'll be fine.,The Truman Show
357,0:50:52,0:50:55,3052,Do you believe that?,The Truman Show
358,0:50:57,0:51:0,3057,"Truman, we're on fire!",The Truman Show
359,0:51:0,0:51:4,3060, It's just smoke. You okay?  Yes.,The Truman Show
360,0:51:4,0:51:7,3064, Wanna do it again?  No!,The Truman Show
361,0:51:8,0:51:10,3068,"Truman, stop!",The Truman Show
362,0:51:13,0:51:16,3073,What do we do for money when we get to New Orleans?,The Truman Show
363,0:51:17,0:51:20,3077,I have my Sea haven bank card.,The Truman Show
364,0:51:21,0:51:25,3081,"So we're just going to eat into our savings, is that it?",The Truman Show
365,0:51:25,0:51:30,3085,I'll have to call your mother. I don't know how she'll take this.,The Truman Show
366,0:51:43,0:51:45,3103,What now?,The Truman Show
367,0:51:45,0:51:48,3105,SEAHAVEN NUCLEAR POWER STATION,The Truman Show
368,0:51:51,0:51:54,3111, Looks like a leak at the plant.  Back up.,The Truman Show
369,0:51:55,0:52:1,3115,Leak at the plant. The whole area is being evacuated.,The Truman Show
370,0:52:2,0:52:6,3122," Thank you for your help.  You're welcome, Truman.",The Truman Show
371,0:52:6,0:52:8,3126,Truman...,The Truman Show
372,0:52:10,0:52:14,3130,"Truman, come back!",The Truman Show
373,0:52:17,0:52:18,3137,Stop him!,The Truman Show
374,0:52:19,0:52:21,3139,Truman!,The Truman Show
375,0:52:40,0:52:42,3160,Stay away!,The Truman Show
376,0:52:57,0:53:3,3177, Thank you both for your help.  Next time he'll be charged.,The Truman Show
377,0:53:3,0:53:8,3183,I understand. Thanks again. Good night.,The Truman Show
378,0:53:26,0:53:31,3206,"Let me get you some help, Truman. You're not well.",The Truman Show
379,0:53:33,0:53:38,3213,Why do you want to have a baby with me? You can't stand me.,The Truman Show
380,0:53:39,0:53:42,3219,That's not true.,The Truman Show
381,0:53:45,0:53:51,3225,I'll fix you some Mococoa. Natural cocoa beans from Mt. Nicaragua.,The Truman Show
382,0:53:51,0:53:58,3231, No artificial sweeteners.  What are you talking about?,The Truman Show
383,0:53:58,0:54:1,3238,I've tasted other cocoas. This is the best.,The Truman Show
384,0:54:2,0:54:6,3242,What the hell does this have to do with anything?,The Truman Show
385,0:54:6,0:54:11,3246, Tell me what's happening!  You're having a nervous breakdown.,The Truman Show
386,0:54:11,0:54:14,3251,"You're part of this, aren't you?",The Truman Show
387,0:54:16,0:54:21,3256,"Truman, you are scaring me.",The Truman Show
388,0:54:21,0:54:25,3261,"No, you're scaring me. What are you gonna do?",The Truman Show
389,0:54:25,0:54:30,3265,"Dice me, slice me or peel me? There's so many choices.",The Truman Show
390,0:54:31,0:54:34,3271,Do something!,The Truman Show
391,0:54:35,0:54:38,3275,What? What did you say?,The Truman Show
392,0:54:39,0:54:42,3279, Who are you talking to?  I didn't say anything.,The Truman Show
393,0:54:43,0:54:48,3283, I wasn't talking to anybody.  Talk to me!,The Truman Show
394,0:54:48,0:54:53,3288, I don't know anything!  Stay where you are.,The Truman Show
395,0:54:53,0:54:55,3293,Truman...?,The Truman Show
396,0:54:58,0:55:0,3298,Thank God!,The Truman Show
397,0:55:5,0:55:10,3305,How can anyone expect me to carry on under these conditions?,The Truman Show
398,0:55:10,0:55:13,3310,It's unprofessional!,The Truman Show
399,0:55:17,0:55:21,3317,Everything's gonna be okay. It's all gonna be fine.,The Truman Show
400,0:55:25,0:55:29,3325,"I don't know what to think, Marlon.",The Truman Show
401,0:55:31,0:55:35,3331,Maybe I'm losing my mind.,The Truman Show
402,0:55:37,0:55:42,3337,It feels like the whole world revolves around me.,The Truman Show
403,0:55:42,0:55:47,3342,That's a lot of world for one man.,The Truman Show
404,0:55:48,0:55:54,3348,Is it wishful thinking? Wishing you'd made more out of yourself?,The Truman Show
405,0:55:54,0:56:1,3354,Who hasn't sat in the john and had an imaginary interview on TV?,The Truman Show
406,0:56:1,0:56:7,3361,This is different. Everybody seems to be in on it.,The Truman Show
407,0:56:9,0:56:13,3369,I've been your best friend since we were seven.,The Truman Show
408,0:56:13,0:56:18,3373,We got through school by cheating off each others test papers.,The Truman Show
409,0:56:18,0:56:22,3378,"Jesus, they were identical.",The Truman Show
410,0:56:23,0:56:26,3383,But I always felt safe knowing that.,The Truman Show
411,0:56:26,0:56:31,3386,"Because whatever the answer was, we were right or wrong together.",The Truman Show
412,0:56:33,0:56:39,3393,I stayed up all night in your tent so you could play North Pole.,The Truman Show
413,0:56:39,0:56:42,3399,And I got pneumonia.,The Truman Show
414,0:56:42,0:56:44,3402,Remember that?,The Truman Show
415,0:56:45,0:56:47,3405,You were out of school for a month.,The Truman Show
416,0:56:53,0:56:59,3413,"You're the closest thing I ever had to a brother, Truman.",The Truman Show
417,0:57:3,0:57:9,3423,Things haven't worked out for us like we used to dream they would.,The Truman Show
418,0:57:11,0:57:16,3431,I know what that feeling's like. Everything slipping away...,The Truman Show
419,0:57:16,0:57:20,3436,"You don't want to believe it, so you look for answers somewhere else.",The Truman Show
420,0:57:27,0:57:33,3447,"But the point is, I'd gladly walk in front of traffic for you.",The Truman Show
421,0:57:38,0:57:43,3458,"But the point's, I'd gladly step in front of traffic for you.",The Truman Show
422,0:57:44,0:57:47,3464,And the last thing I'd ever do is lie to you.,The Truman Show
423,0:57:49,0:57:56,3469,And the last thing that I would ever do... is lie to you.,The Truman Show
424,0:57:59,0:58:2,3479,"I mean, think about it.",The Truman Show
425,0:58:3,0:58:8,3483,"If everybody is in on it... I'd have to be in on it, too.",The Truman Show
426,0:58:17,0:58:22,3497,"I'm not in on it, Truman, because there is no ""it"".",The Truman Show
427,0:58:26,0:58:30,3506, You were right about one thing.  What's that?,The Truman Show
428,0:58:33,0:58:36,3513,The thing that started all this.,The Truman Show
429,0:58:50,0:58:55,3530,"I found him for you, Truman. That's why I came by tonight.",The Truman Show
430,0:58:56,0:59:0,3536,I'm sure he's got quite a story to tell.,The Truman Show
431,0:59:2,0:59:4,3542,Go to him.,The Truman Show
432,0:59:10,0:59:13,3550,Easy on the fog.,The Truman Show
433,0:59:14,0:59:18,3554,"Stand by, cranecam... Cranecam.",The Truman Show
434,0:59:26,0:59:28,3566,Buttoncam three.,The Truman Show
435,0:59:40,0:59:43,3580,I never stopped believing.,The Truman Show
436,0:59:45,0:59:48,3585,Go wide. Curbcam eight.,The Truman Show
437,0:59:49,0:59:50,3589,My son.,The Truman Show
438,0:59:51,0:59:55,3591," Move in for closeup?  No, no...",The Truman Show
439,0:59:56,0:59:59,3596,Stay back. Fade up music.,The Truman Show
440,1:0:6,1:0:9,3606,Now go for the closeup.,The Truman Show
441,1:0:9,1:0:14,3609,"All those years wasted. I'll make it up to you, son.",The Truman Show
442,1:0:15,1:0:16,3615,I swear.,The Truman Show
443,1:0:22,1:0:24,3622,Dad...,The Truman Show
444,1:0:36,1:0:37,3636,Bravo!,The Truman Show
445,1:0:38,1:0:41,3638,Congratulations.,The Truman Show
446,1:0:41,1:0:46,3641," Okay, quiet down. Concentrate.  That was great television.",The Truman Show
447,1:0:52,1:0:56,3652," Christ of, it was brilliant!  It broke my heart.",The Truman Show
448,1:0:59,1:1:1,3659,Well done! Congratulations!,The Truman Show
449,1:1:10,1:1:13,3670,"Truman drinks Mococoa, world's finest cocoa beans ",The Truman Show
450,1:1:13,1:1:16,3673, Grown on the upper slopes of Mt. Nicaragua.,The Truman Show
451,1:1:20,1:1:24,3680,1. 7 billion were there for his birth.,The Truman Show
452,1:1:27,1:1:30,3687,220 countries tuned in for his first step.,The Truman Show
453,1:1:30,1:1:34,3690,The world stood still for that stolen kiss.,The Truman Show
454,1:1:34,1:1:39,3694,"And as he grew, so did the technology. A human life. ",The Truman Show
455,1:1:39,1:1:44,3699, Recorded on a network of hidden cameras and broadcast live ,The Truman Show
456,1:1:44,1:1:49,3704," 24 hours a day, seven days a week, to an audience around the globe.",The Truman Show
457,1:1:50,1:1:56,3710,"From Sea haven, enclosed in the largest studio ever constructed. ",The Truman Show
458,1:1:56,1:2:2,3716, One of only two manmade structures visible from space. ,The Truman Show
459,1:2:2,1:2:8,3722," Now in its 30th great year, it's The Truman Show!",The Truman Show
460,1:2:12,1:2:16,3732,What a week! I was on pins and needles the entire time.,The Truman Show
461,1:2:16,1:2:19,3736,"I'm your host, Mike Michelson.",The Truman Show
462,1:2:19,1:2:23,3739,"Welcome to TrueTalk, our forum for issues growing out of the show.",The Truman Show
463,1:2:23,1:2:26,3743,"Tonight, something very special:",The Truman Show
464,1:2:27,1:2:31,3747,An exclusive interview with the show's creator.,The Truman Show
465,1:2:31,1:2:38,3751,Let's go live to the 221stfloor of the OmniCam Ecosphere.,The Truman Show
466,1:2:38,1:2:42,3758,There we'll find the world's greatest televisionary.,The Truman Show
467,1:2:42,1:2:47,3762,The designer of the world within a world that's Sea haven: Christ of.,The Truman Show
468,1:2:47,1:2:52,3767,I'd like to thank you for granting this interview.,The Truman Show
469,1:2:53,1:2:58,3773,"We know your schedule is demanding, and how you guard your privacy.",The Truman Show
470,1:2:58,1:3:2,3778," This, sir, is indeed an honor.  Don't mention it.",The Truman Show
471,1:3:3,1:3:6,3783,The catalyst for the recent dramatic events ,The Truman Show
472,1:3:6,1:3:11,3786," Has been Truman's father, Kirk, and his attempt at in filtration.",The Truman Show
473,1:3:11,1:3:16,3791,"This is not the first time someone has tried to reach Truman, is it?",The Truman Show
474,1:3:17,1:3:20,3797,We have had our close calls.,The Truman Show
475,1:3:20,1:3:27,3800,It's television! I did it! I'm on The Truman Show!,The Truman Show
476,1:3:27,1:3:35,3807,"But now, the first intruder to be a former cast member.",The Truman Show
477,1:3:35,1:3:40,3815," A dead one at that.  Writing Kirk back in, brilliant.",The Truman Show
478,1:3:40,1:3:46,3820,Kirk started this whole crisis. He was the only one who could end it.,The Truman Show
479,1:3:46,1:3:48,3826,"Truman, no!",The Truman Show
480,1:3:49,1:3:52,3829, That's off limits!  Why? What's over there?,The Truman Show
481,1:3:53,1:3:57,3833,"Nothing. It's dangerous, that's all. You have to know your limitations.",The Truman Show
482,1:3:57,1:4:2,3837,Let's remind viewers why Dad was written outin' the first place.,The Truman Show
483,1:4:2,1:4:7,3842,"As Truman grew up, we manufactured ways to keep him on the island.",The Truman Show
484,1:4:7,1:4:14,3847, I'd like to be a great explorer.  There's nothing left to explore.,The Truman Show
485,1:4:18,1:4:24,3858, Then I thought up Kirk's drowning.  He's feared the water ever since.,The Truman Show
486,1:4:24,1:4:31,3864,"When Kirk read the synopsis, he was disappointed, to say the least.",The Truman Show
487,1:4:31,1:4:35,3871,I'm sure that's why he broke onto the set.,The Truman Show
488,1:4:35,1:4:39,3875,But how do you intend to explain his 22year absence?,The Truman Show
489,1:4:40,1:4:42,3880, Amnesia.  Brilliant.,The Truman Show
490,1:4:42,1:4:49,3882,"Let's take some viewer calls. North Carolina, you're on with Christ of.",The Truman Show
491,1:4:49,1:4:54,3889,"Hi, Christ of. I was wondering how many cameras you got in that town.",The Truman Show
492,1:4:54,1:4:59,3894,"Somewhere in the vicinity of5,000.",The Truman Show
493,1:4:59,1:5:3,3899,"Remember, we started with just one.",The Truman Show
494,1:5:3,1:5:10,3903,"He was two weeks premature, as if he couldn't wait to get started.",The Truman Show
495,1:5:10,1:5:15,3910,And his eagerness to leave the womb was the reason he was selected.,The Truman Show
496,1:5:15,1:5:19,3915,In competition with five other unwanted pregnancies ,The Truman Show
497,1:5:19,1:5:25,3919," For a show determined by an air date, only Truman arrived on cue.",The Truman Show
498,1:5:28,1:5:33,3928,I believe Truman is the first child to be adopted by a corporation.,The Truman Show
499,1:5:33,1:5:37,3933, That's correct.  The show's made enormous revenue.,The Truman Show
500,1:5:37,1:5:40,3937,Equivalent to the GNP of a small country.,The Truman Show
501,1:5:40,1:5:45,3940,It takes the population of an entire country to keep it running.,The Truman Show
502,1:5:45,1:5:52,3945,"Since it's on 24 hours, revenues are generated by product placement.",The Truman Show
503,1:5:52,1:5:57,3952,"Everything on the show is for sale, down to the very homes they live in.",The Truman Show
504,1:5:57,1:6:1,3957,All of tin the Truman catalogue. Operators are standing by.,The Truman Show
505,1:6:2,1:6:7,3962,"Christ of, why has Truman never come close to discovering ",The Truman Show
506,1:6:7,1:6:11,3967, The true nature of his world until now?,The Truman Show
507,1:6:11,1:6:15,3971,We accept the reality of the world with which we're presented.,The Truman Show
508,1:6:17,1:6:21,3977,The Hague for Christ of. Hello. The Hague...,The Truman Show
509,1:6:22,1:6:26,3982,"All right, let's go to Hollywood, California.",The Truman Show
510,1:6:26,1:6:32,3986,"You're a liar and a manipulator, and what you've done to Truman is sick.",The Truman Show
511,1:6:32,1:6:38,3992,"Well, we remember this voice, don't we? How could we forget?",The Truman Show
512,1:6:39,1:6:43,3999," Let's go to another call.  No, no. It's fine, Mike.",The Truman Show
513,1:6:43,1:6:48,4003,I love to reminisce with former members of the cast.,The Truman Show
514,1:6:48,1:6:54,4008,"Sylvia, as you announced so melodramatically to the world...",The Truman Show
515,1:6:54,1:6:59,4014,Do you think because you batted your eyes at Truman once. ,The Truman Show
516,1:6:59,1:7:3,4019," Flirted with him, stole a few minutes of air time ",The Truman Show
517,1:7:3,1:7:8,4023," To thrust your politics into the limelight, that you know him?",The Truman Show
518,1:7:8,1:7:13,4028,That you know what's right for him? Are you in a position to judge him?,The Truman Show
519,1:7:13,1:7:18,4033,What right do you have to turn a baby's life into a mockery?,The Truman Show
520,1:7:18,1:7:22,4038,Don't you ever feel guilty.,The Truman Show
521,1:7:22,1:7:27,4042,I have given Truman the chance to lead a normal life.,The Truman Show
522,1:7:28,1:7:32,4048,"The world, the place you live in. ",The Truman Show
523,1:7:32,1:7:37,4052, Is the sick place. Sea haven is the way the world should be.,The Truman Show
524,1:7:37,1:7:43,4057," He's a prisoner, not a performer.  He can leave at any time.",The Truman Show
525,1:7:43,1:7:48,4063,"If his was more than a vague ambition, if he was determined ",The Truman Show
526,1:7:48,1:7:54,4068," To discover the truth, there's no way we could prevent him.",The Truman Show
527,1:7:54,1:7:59,4074,"I think what distresses you, really, caller. ",The Truman Show
528,1:7:59,1:8:5,4079," Is that, ultimately, Truman prefers his cell, as you call it.",The Truman Show
529,1:8:5,1:8:10,4085,That's where you're so wrong. And he'll prove you wrong.,The Truman Show
530,1:8:11,1:8:17,4091,"These heated comments aside, it's been a very positive experience.",The Truman Show
531,1:8:17,1:8:21,4097,For Truman and for the viewers.,The Truman Show
532,1:8:21,1:8:28,4101,Thank you for your time. Now that this crisis is behind us. ,The Truman Show
533,1:8:28,1:8:32,4108, Can we look forward to some exciting new developments?,The Truman Show
534,1:8:32,1:8:38,4112,The big news is: Meryl will leave Truman in an upcoming episode.,The Truman Show
535,1:8:38,1:8:41,4118,A new romantic interest will be introduced.,The Truman Show
536,1:8:42,1:8:46,4122,I'm determined that TVs first onair conception will take place.,The Truman Show
537,1:8:46,1:8:49,4126,Another television milestone.,The Truman Show
538,1:8:50,1:8:56,4130,"It has been a singular honor and a pleasure. Christ of, thank you.",The Truman Show
539,1:10:14,1:10:16,4214,"Hey, Simeon.",The Truman Show
540,1:10:20,1:10:25,4220, Is he looking at us?  You think he knows?,The Truman Show
541,1:10:26,1:10:29,4226, Hello...  Better call Christ of.,The Truman Show
542,1:10:29,1:10:32,4229,"Come in, Major Burbank.",The Truman Show
543,1:10:48,1:10:52,4248,He's back to his old self.,The Truman Show
544,1:10:59,1:11:3,4259,"That's an unusual cat, my man.",The Truman Show
545,1:11:6,1:11:11,4266,I hereby proclaim this planet...,The Truman Show
546,1:11:14,1:11:18,4274,...Trumania of the Burbank galaxy.,The Truman Show
547,1:11:19,1:11:23,4279, Is he gonna go?  Hallway camera ready.,The Truman Show
548,1:11:24,1:11:29,4284," That one's for free.  Stand by, all house cameras.",The Truman Show
549,1:11:30,1:11:34,4290, Good morning.  Good morning.,The Truman Show
550,1:11:34,1:11:39,4294, In case I don't see you... ...good afternoon and good night.,The Truman Show
551,1:11:41,1:11:46,4301,"Good afternoon, good night...",The Truman Show
552,1:11:46,1:11:53,4306," Morning, Truman. Hows it going?  I'll check. Vital signs are good.",The Truman Show
553,1:11:55,1:11:57,4315,"Hey, Pluto!",The Truman Show
554,1:11:58,1:12:1,4318, Good morning!  Look who's here.,The Truman Show
555,1:12:1,1:12:6,4321,"Beautiful day, isn't it? We thought about the policy, and we'll take it.",The Truman Show
556,1:12:6,1:12:11,4326,Great! Let's go up to my office and sign the papers.,The Truman Show
557,1:12:11,1:12:15,4331, Next week would be better.  I knew it. See you guys.,The Truman Show
558,1:12:16,1:12:19,4336, See you next week.  Looking forward to it!,The Truman Show
559,1:12:20,1:12:24,4340,This isn't about insurance. This is about the great variable.,The Truman Show
560,1:12:24,1:12:30,4344,"When will death occur? Could be a week, a month, a year...",The Truman Show
561,1:12:30,1:12:33,4350,Could be today.,The Truman Show
562,1:12:33,1:12:39,4353,"Innocent sunbather, stabbed by the tip of a runaway beach umbrella.",The Truman Show
563,1:12:39,1:12:42,4359,No way to guard against that.,The Truman Show
564,1:12:44,1:12:47,4364," Excuse me.  Truman, this is Vivian.",The Truman Show
565,1:12:48,1:12:51,4368,The two of you are going to be neighbors.,The Truman Show
566,1:12:54,1:13:0,4374,I guess what I'm saying is that life is... fragile.,The Truman Show
567,1:13:1,1:13:5,4381," Vivian, your office.  Sorry.",The Truman Show
568,1:13:5,1:13:9,4385,I'm sorry... You do?,The Truman Show
569,1:13:9,1:13:13,4389,"Oh, great. Let me take your information.",The Truman Show
570,1:13:29,1:13:32,4409,"Ready, two. Go to two.",The Truman Show
571,1:13:35,1:13:40,4415,Back to medium... and wide.,The Truman Show
572,1:13:48,1:13:53,4428,I was just trying to train the kid to... never mind.,The Truman Show
573,1:13:56,1:14:1,4436, What's he doing in the basement?  He moved in there when Meryl left.,The Truman Show
574,1:14:1,1:14:6,4441,Why wasn't I told? Unpredictable behavior has to be reported.,The Truman Show
575,1:14:6,1:14:11,4446, He's just sleeping. I thought...  This is the best shot we've got?,The Truman Show
576,1:14:11,1:14:15,4451, What's on the clockcam?  Obstruction.,The Truman Show
577,1:14:16,1:14:20,4456, What happened?  He was tidying up his garbage.,The Truman Show
578,1:14:20,1:14:25,4460,"I was gonna call you, but he gave up and fell asleep.",The Truman Show
579,1:14:25,1:14:30,4465, I want to check the setups... ...for the insurance convention.,The Truman Show
580,1:14:30,1:14:32,4470,Nice move.,The Truman Show
581,1:14:40,1:14:43,4480,There you go.,The Truman Show
582,1:14:52,1:14:57,4492,Isolate the audio. Give me a closeup on his torso.,The Truman Show
583,1:15:0,1:15:3,4500,Still breathing.,The Truman Show
584,1:15:4,1:15:9,4504,Where's Chloe? Call him. Tell him it's a wrong number.,The Truman Show
585,1:15:12,1:15:17,4512, What took you so long?  I had to wait for it.,The Truman Show
586,1:15:17,1:15:23,4517, They were busy. What's going on?  I don't know.,The Truman Show
587,1:15:23,1:15:28,4523, He did nothing but stand around.  Shut up and watch.,The Truman Show
588,1:15:28,1:15:32,4528,Then we went to night vision. He's asleep.,The Truman Show
589,1:15:34,1:15:39,4534,There! Stop it. Zoom in under the chair.,The Truman Show
590,1:15:42,1:15:48,4542, Enhance it.  Is it...? My God...,The Truman Show
591,1:15:48,1:15:55,4548, He didn't go up the stairs.  Get Marlon over there!,The Truman Show
592,1:16:11,1:16:15,4571,Truman... Surprise party!,The Truman Show
593,1:16:16,1:16:21,4576,I got a sixpack of cold brew skies with our name on them.,The Truman Show
594,1:16:21,1:16:25,4581,"Come on, pal. Come on, buddy.",The Truman Show
595,1:16:27,1:16:28,4587,Shit!,The Truman Show
596,1:16:31,1:16:35,4591,"Marlon, find him. He's still in the room.",The Truman Show
597,1:16:38,1:16:42,4598," Come out, wherever you are.  Good. Keep it light.",The Truman Show
598,1:16:42,1:16:45,4602,I know you're in here.,The Truman Show
599,1:16:49,1:16:55,4609,"Check under the table. The closet, behind you.",The Truman Show
600,1:17:0,1:17:5,4620,"Gee, I wonder where he could possibly be.",The Truman Show
601,1:17:13,1:17:14,4633,Lawncam!,The Truman Show
602,1:17:22,1:17:26,4642, Say something. Keep it going.  He's gone.,The Truman Show
603,1:17:26,1:17:29,4646, Cut transmission!  Cut transmission?,The Truman Show
604,1:17:33,1:17:38,4653, God in heaven!  Give me the phone!,The Truman Show
605,1:17:45,1:17:48,4665,TECHNICAL FAULT PLEASE STAND BY,The Truman Show
606,1:18:0,1:18:6,4680,"We've got every available extra looking for him. The crew, too.",The Truman Show
607,1:18:7,1:18:10,4687, What about prop cars?  Accounted for.,The Truman Show
608,1:18:11,1:18:15,4691,"He has the world's most recognizable face, he can't disappear.",The Truman Show
609,1:18:54,1:18:58,4734,"Go find him, Pluto. Good dog.",The Truman Show
610,1:18:58,1:19:3,4738,All this fuss! If he could just hear my voice.,The Truman Show
611,1:19:3,1:19:6,4743,Truman! Truman!,The Truman Show
612,1:19:7,1:19:11,4747,Let me try. Truman!,The Truman Show
613,1:19:11,1:19:16,4751,"It's me, Dad! Let's talk!",The Truman Show
614,1:19:19,1:19:23,4759,"Yeah, I know. We're just about done with the square.",The Truman Show
615,1:19:23,1:19:27,4763,"We've got to go back to Barrymore, check the interiors.",The Truman Show
616,1:19:28,1:19:34,4768,Who's watching the college? Send someone over there.,The Truman Show
617,1:19:39,1:19:43,4779," Take another man, get down there.  Find the son of a bitch!",The Truman Show
618,1:19:43,1:19:47,4783,Get some batteries. He's not gonna glow in the dark.,The Truman Show
