Index,Start Time,End Time,Start Time (sec),Text,Movie
0,0:5:15,0:5:18,315,Your move: Bishop to knight four.,The Thing
1,0:5:18,0:5:21,318,My move: Knight to rook three.,The Thing
2,0:5:22,0:5:25,322,"Poor baby, you're starting to lose it, aren't ya?",The Thing
3,0:5:31,0:5:33,331,Your move: King to rook one.,The Thing
4,0:5:34,0:5:36,334,My move: Rook to knight six.,The Thing
5,0:5:37,0:5:39,337,Checkmate. Checkmate.,The Thing
6,0:5:45,0:5:47,345,You cheating bitch.,The Thing
7,0:6:50,0:6:54,410," Childs, what's he doing?  Circling the camp.",The Thing
8,0:6:55,0:6:57,415,Who is he?,The Thing
9,0:6:57,0:7:0,417," Said ""Norge"" or something on the side.  It's Norwegian.",The Thing
10,0:9:5,0:9:7,545," George, are you okay?  Yeah, yeah, I'm okay.",The Thing
11,0:9:7,0:9:10,547, Are you?  Yeah. What's going on there?,The Thing
12,0:9:32,0:9:33,572,Watch it.,The Thing
13,0:9:58,0:9:59,598,Easy.,The Thing
14,0:9:59,0:10:3,599,"Easy, easy, easy. Yes.",The Thing
15,0:10:15,0:10:18,615,First goddamn week of winter.,The Thing
16,0:10:27,0:10:32,627,"Oh, come on. Four stitches. Barely grazed you.",The Thing
17,0:10:33,0:10:38,633,"What were they doing flying that low, shooting at a dog, at us?",The Thing
18,0:10:38,0:10:42,638,Stircrazy. Cabin fever. Who knows?,The Thing
19,0:10:43,0:10:47,643,"U.S. Number 31, calling McMurdo. Come in. Over.",The Thing
20,0:10:49,0:10:54,649,"U.S. Number 31, calling McMurdo. Urgent. Come in. Over.",The Thing
21,0:10:56,0:10:57,656,Great.,The Thing
22,0:10:57,0:11:0,657," Come on, come on.  Nobody!",The Thing
23,0:11:0,0:11:2,660,Nobody. Get a hold of somebody.,The Thing
24,0:11:2,0:11:4,662,Get a hold of anybody. We gotta report this mess.,The Thing
25,0:11:4,0:11:7,664,"Look, I haven't been able to reach shit in two weeks.",The Thing
26,0:11:8,0:11:11,668,"I doubt if anybody's talked to anybody on this entire continent,",The Thing
27,0:11:11,0:11:13,671,and you want me to reach somebody!,The Thing
28,0:11:25,0:11:26,685,Maybe we're at war with Norway.,The Thing
29,0:11:31,0:11:36,691,I was wondering when the El Capitan was gonna get a chance to use his popgun.,The Thing
30,0:11:40,0:11:44,700, How long have they been stationed there?  It says here only eight weeks.,The Thing
31,0:11:44,0:11:46,704,"Well, that's not long enough for guys to go bonkers.",The Thing
32,0:11:46,0:11:49,706,"Bullshit, bwana. Five minutes is enough to put a man over down here.",The Thing
33,0:11:49,0:11:50,709,Damn straight.,The Thing
34,0:11:50,0:11:54,710,"I mean, look at Palmer. He been the way he is since the first day.",The Thing
35,0:11:55,0:11:56,715,How many in their party?,The Thing
36,0:11:57,0:11:59,717,They started with 10. There'd be eight others left.,The Thing
37,0:11:59,0:12:3,719,How do we know? Guys as crazy as that could have done a lot of damage,The Thing
38,0:12:3,0:12:4,723,to their own before they got to us.,The Thing
39,0:12:4,0:12:7,724," Nothing we can do about that.  Yes, there is. I wanna go up.",The Thing
40,0:12:7,0:12:9,727, In this weather?  Bennings?,The Thing
41,0:12:9,0:12:11,729,Winds are gonna let up a tad next couple of hours.,The Thing
42,0:12:11,0:12:13,731,A tad?,The Thing
43,0:12:13,0:12:17,733,"Can't condone it much myself, but it is a short haul.",The Thing
44,0:12:17,0:12:19,737,"An hour there, an hour back.",The Thing
45,0:12:21,0:12:24,741,"Shit, Doc, I'll give you the lift. No problem.",The Thing
46,0:12:24,0:12:28,744," Forget it, Palmer.  Hey, thanks for thinking about it though.",The Thing
47,0:12:32,0:12:34,752,Loaded with kerosene. I count 15 cans.,The Thing
48,0:12:35,0:12:38,755,"MacReady! Mac, get your gear on!",The Thing
49,0:12:48,0:12:51,768," Mac, it may not clear up for a week.  Yeah.",The Thing
50,0:12:51,0:12:53,771," We're the closest ones to them.  It's all right by me, Doc.",The Thing
51,0:12:53,0:12:56,773,I'm just letting you know we're taking a chance.,The Thing
52,0:12:56,0:12:58,776,"Quit the griping, MacReady.",The Thing
53,0:12:58,0:13:0,778,"Those clouds keep moving over the sun, we're gonna get a whiteout.",The Thing
54,0:13:0,0:13:2,780,"We get caught in that, you can scratch one doctor and one pilot.",The Thing
55,0:13:3,0:13:5,783,This is real thin. It'll clear as soon as you get up.,The Thing
56,0:13:8,0:13:12,788,"It's up to you, Mac. If you don't wanna fly, we don't fly.",The Thing
57,0:13:13,0:13:15,793,"You really wanna save those crazy Swedes, huh?",The Thing
58,0:13:15,0:13:16,795,Norwegians.,The Thing
59,0:13:16,0:13:18,796," Which way, Doc?  Southwest.",The Thing
60,0:13:18,0:13:21,798,You're gonna have to read the map. 'Cause I'm gonna be busy.,The Thing
61,0:13:28,0:13:30,808,"Mac's really taking it up, huh?",The Thing
62,0:13:32,0:13:33,812,He knows what he's doing.,The Thing
63,0:14:36,0:14:38,876,"Nauls, will you turn that crap down?",The Thing
64,0:14:38,0:14:41,878,I'm trying to get some sleep. I was shot today.,The Thing
65,0:14:42,0:14:44,882,"Read, bwana. Will do.",The Thing
66,0:14:46,0:14:48,886,Writing's on the wall,The Thing
67,0:14:51,0:14:53,891,Very superstitious,The Thing
68,0:17:10,0:17:11,1030,Anybody there?,The Thing
69,0:17:13,0:17:14,1033,"Hey, Sweden!",The Thing
70,0:17:14,0:17:17,1034,"They're not Swedish, Mac. They're Norwegian.",The Thing
71,0:18:41,0:18:42,1121,Mac!,The Thing
72,0:19:18,0:19:20,1158,My God. What the hell happened here?,The Thing
73,0:19:23,0:19:24,1163,"Come on, Doc.",The Thing
74,0:20:3,0:20:8,1203, Portable video unit. Anything?  It's all in Norwegian.,The Thing
75,0:20:14,0:20:16,1214,"What are you doing, Doc?",The Thing
76,0:20:16,0:20:17,1216,Could be important work. I wanna take it back.,The Thing
77,0:20:17,0:20:20,1217,"Well, it's getting late. Let's hurry it up.",The Thing
78,0:20:20,0:20:22,1220,I'll check out the last few rooms.,The Thing
79,0:20:41,0:20:43,1241,"Hey, Copper, come here!",The Thing
80,0:21:26,0:21:28,1286,"Maybe they found a fossil,",The Thing
81,0:21:28,0:21:31,1288,"the remains of some animal buried in the ice, and they chopped it out.",The Thing
82,0:21:31,0:21:33,1291, But where is it?  Look at this.,The Thing
83,0:21:48,0:21:49,1308,What is that?,The Thing
84,0:21:51,0:21:53,1311,Is that a man in there or something?,The Thing
85,0:21:55,0:21:58,1315,"Whatever it is, they burned it up in a hurry.",The Thing
86,0:22:0,0:22:2,1320,"Help me find a shovel, Doc.",The Thing
87,0:22:59,0:23:0,1379,We found this.,The Thing
88,0:23:1,0:23:2,1381,Jesus Christ.,The Thing
89,0:23:28,0:23:31,1408,"Blair, I'd like you to start an autopsy right away.",The Thing
90,0:24:32,0:24:34,1472,Did you reach anybody yet?,The Thing
91,0:24:34,0:24:38,1474,"Reach anybody? We're a thousand miles from nowhere, man,",The Thing
92,0:24:38,0:24:40,1478,and it's gonna get worse before it gets better.,The Thing
93,0:24:40,0:24:43,1480,"Well, stick to it, Windows. Stick to it.",The Thing
94,0:24:48,0:24:51,1488,"Nothing wrong with this Norwegian, physiologically anyway.",The Thing
95,0:24:52,0:24:54,1492,"No drugs, no alcohol. Nothing.",The Thing
96,0:25:18,0:25:21,1518,"Well, what we got here is what appears to be, anyway,",The Thing
97,0:25:21,0:25:24,1521,a normal set of internal organs.,The Thing
98,0:25:26,0:25:27,1526,"Heart,",The Thing
99,0:25:28,0:25:30,1528,"lungs, kidneys, liver.",The Thing
100,0:25:32,0:25:33,1532,Intestines.,The Thing
101,0:25:37,0:25:39,1537,Seem to be normal.,The Thing
102,0:25:56,0:25:59,1556,"One, door number two and door number three.",The Thing
103,0:25:59,0:26:3,1559,And I think that Dawn Screen here has got the one to trade in the most.,The Thing
104,0:26:3,0:26:5,1563,I went to you first. You brought your friend Anna.,The Thing
105,0:26:5,0:26:8,1565,You've been consulting Anna all through the show anyhow.,The Thing
106,0:26:8,0:26:9,1568,You may as well consult her one more time.,The Thing
107,0:26:9,0:26:11,1569,I know how this one ends.,The Thing
108,0:26:48,0:26:51,1608,"Clark, will you put this mutt with the others where he belongs?",The Thing
109,0:26:54,0:26:55,1614,"Yeah, okay.",The Thing
110,0:27:16,0:27:17,1636,Go ahead.,The Thing
111,0:27:21,0:27:23,1641,Go ahead. What are you waiting for?,The Thing
112,0:30:15,0:30:18,1815,"I don't know what the hell's in there, but it's weird and pissed off, whatever it is.",The Thing
113,0:30:18,0:30:20,1818,"Bennings, go get Childs.",The Thing
114,0:30:20,0:30:22,1820,What is this? What's going on?,The Thing
115,0:30:22,0:30:25,1822," Hey, Palmer, what is this?  I don't know.",The Thing
116,0:30:25,0:30:28,1825," Childs, Mac wants the flamethrower!  Mac wants the what?",The Thing
117,0:30:28,0:30:31,1828," That's what he said. Now, move!  Damn it.",The Thing
118,0:30:44,0:30:46,1844," Stay back.  Hey, Mac, what is it?",The Thing
119,0:31:34,0:31:37,1894, Don't! No!  Get away!,The Thing
120,0:31:37,0:31:39,1897,Get back! Get back!,The Thing
121,0:32:4,0:32:6,1924,Get your ass over here!,The Thing
122,0:32:8,0:32:9,1928,Burn it.,The Thing
123,0:32:13,0:32:15,1933,"Damn it, Childs. Torch it!",The Thing
124,0:33:37,0:33:38,2017,"Oh, my God.",The Thing
125,0:33:45,0:33:49,2025,Oh!,The Thing
126,0:33:54,0:33:57,2034,Look. Son of a bitch. Oh.,The Thing
127,0:34:14,0:34:16,2054,"You see, what we're talking about here is an organism",The Thing
128,0:34:16,0:34:20,2056,"that imitates other lifeforms, and it imitates them perfectly.",The Thing
129,0:34:20,0:34:23,2060,"When this thing attacked our dogs, it tried to digest them,",The Thing
130,0:34:23,0:34:25,2063,"absorb them,",The Thing
131,0:34:26,0:34:29,2066,"and in the process, shape its own cells to imitate them.",The Thing
132,0:34:32,0:34:36,2072,"This, for instance... that's not dog.",The Thing
133,0:34:38,0:34:42,2078,It's imitation. We got to it before it had time to finish.,The Thing
134,0:34:44,0:34:45,2084,Finish what?,The Thing
135,0:34:46,0:34:49,2086,Finish imitating these dogs.,The Thing
136,0:34:56,0:34:59,2096,"Easy, easy. Good.",The Thing
137,0:35:2,0:35:4,2102,"Easy, easy.",The Thing
138,0:35:10,0:35:11,2110, Clark.  Yeah?,The Thing
139,0:35:12,0:35:15,2112,"Did you notice anything strange about the dog, anything at all?",The Thing
140,0:35:15,0:35:17,2115,Strange? No.,The Thing
141,0:35:19,0:35:22,2119,What was the dog doing in the rec room?,The Thing
142,0:35:22,0:35:23,2122,I don't know.,The Thing
143,0:35:23,0:35:26,2123,He was just wandering around camp all day.,The Thing
144,0:35:28,0:35:32,2128,Are you saying to me the dog wasn't put in the kennel until last night?,The Thing
145,0:35:33,0:35:34,2133,Right.,The Thing
146,0:35:36,0:35:38,2136,How long were you alone with that dog?,The Thing
147,0:35:38,0:35:42,2138,"I don't know. An hour. Hour and a half, maybe.",The Thing
148,0:35:44,0:35:47,2144,What the hell you looking at me like that for?,The Thing
149,0:35:50,0:35:52,2150, I don't know.  What?,The Thing
150,0:35:53,0:35:55,2153,I don't know. It's probably nothing.,The Thing
151,0:35:58,0:36:0,2158,It's nothing at all.,The Thing
152,0:36:11,0:36:13,2171,How much more of this crap is there?,The Thing
153,0:36:13,0:36:15,2173,"Oh, about nine hours, I'd say.",The Thing
154,0:36:16,0:36:20,2176, We can't learn anything from this.  Guess not.,The Thing
155,0:36:31,0:36:33,2191,Where'd they take these shots?,The Thing
156,0:36:34,0:36:36,2194,Seems like they were spending a lot of their time,The Thing
157,0:36:36,0:36:39,2196,in a little place northeast of their camp about five or six miles.,The Thing
158,0:36:39,0:36:40,2199,What's that?,The Thing
159,0:36:42,0:36:44,2202,It looks like something buried under the ice.,The Thing
160,0:36:51,0:36:54,2211,And look at that. They're planting thermite charges.,The Thing
161,0:36:55,0:36:58,2215,"Whatever it was, it was bigger than that block of ice you found.",The Thing
162,0:37:8,0:37:12,2228,Here. This is it. The place where they were spending most of their time.,The Thing
163,0:37:12,0:37:15,2232," Pretty nasty out, Mac. 35 knots.  Screw it. I'm gonna go up anyway.",The Thing
164,0:37:39,0:37:41,2259,Half a mile due east.,The Thing
165,0:39:19,0:39:22,2359,"Jesus, how long do you figure this has been in the ice?",The Thing
166,0:39:23,0:39:27,2363,"Well, the backscatter effect's been bringing things up",The Thing
167,0:39:27,0:39:30,2367,from way down around here for a long time.,The Thing
168,0:39:30,0:39:35,2370,"I'd say... I'd say the ice it's buried in is 100,000 years old, at least.",The Thing
169,0:39:38,0:39:40,2378, And those Norwegians blew it up?  Yeah.,The Thing
170,0:40:10,0:40:11,2410,I don't know.,The Thing
171,0:40:11,0:40:15,2411,"Thousands of years ago, it crashes, and this thing...",The Thing
172,0:40:16,0:40:20,2416,"Gets thrown out or crawls out, and it ends up freezing in the ice.",The Thing
173,0:40:20,0:40:23,2420,I just cannot believe any of this voodoo bullshit.,The Thing
174,0:40:24,0:40:26,2424,"Childs, it happens all the time, man.",The Thing
175,0:40:27,0:40:30,2427,They're falling out of the skies like flies.,The Thing
176,0:40:30,0:40:32,2430,"Government knows all about it. Right, Mac?",The Thing
177,0:40:32,0:40:35,2432,"Do you believe any of this voodoo bullshit, Blair?",The Thing
178,0:40:35,0:40:39,2435,"Childs. Childs. Chariots Of The Gods, man.",The Thing
179,0:40:40,0:40:42,2440,They practically own South America.,The Thing
180,0:40:42,0:40:45,2442,"I mean, they taught the Incas everything they know.",The Thing
181,0:40:52,0:40:54,2452,"Come on, now, MacReady.",The Thing
182,0:40:54,0:40:57,2454,"The Norwegians get a hold of this, and they dig it up out of the ice.",The Thing
183,0:40:57,0:41:0,2457,"Yes, Garry, they dig it up. They cart it back.",The Thing
184,0:41:0,0:41:3,2460,"It gets thawed out, wakes up, not in the best of moods.",The Thing
185,0:41:3,0:41:6,2463, I don't know. I wasn't there.  Which one of you disrespectful men,The Thing
186,0:41:6,0:41:9,2466,"been tossing his dirty drawers in the kitchen trash can, huh?",The Thing
187,0:41:10,0:41:13,2470,"From now on I want my kitchen clean, germfree.",The Thing
188,0:41:13,0:41:16,2473,Now how's this motherfucker wake up after thousands of years in the ice?,The Thing
189,0:41:17,0:41:19,2477, And how could it look like a dog?  I don't know how.,The Thing
190,0:41:20,0:41:23,2480,"'Cause it's different than us, see? 'Cause it's from outer space.",The Thing
191,0:41:23,0:41:25,2483,What do you want from me? Ask him.,The Thing
192,0:41:30,0:41:32,2490,"You buy any of this, Blair?",The Thing
193,0:43:33,0:43:37,2613,"Mac, removing those things out of the lab into the storeroom.",The Thing
194,0:43:37,0:43:39,2617,Can you come get your stuff?,The Thing
195,0:43:40,0:43:42,2620,"Be there in a minute, Doc.",The Thing
196,0:43:59,0:44:1,2639,Through the door.,The Thing
197,0:44:4,0:44:6,2644,Right over here. Right over...,The Thing
198,0:44:10,0:44:12,2650,"Sorry, Mac. You have to move your stuff...",The Thing
199,0:44:13,0:44:16,2653,Doc says we gotta lock him up. Stash him in here and lock him up.,The Thing
200,0:44:17,0:44:19,2657," I have to talk to you.  I'm tired of talking, Fuchs.",The Thing
201,0:44:19,0:44:21,2659,I just wanna get up to my shack and get drunk.,The Thing
202,0:44:21,0:44:23,2661," Mac, it's important.  What is it?",The Thing
203,0:44:25,0:44:27,2665, Outside.  It's 40 below outside.,The Thing
204,0:44:27,0:44:29,2667,"In the Thiokol. Please, Mac.",The Thing
205,0:44:45,0:44:49,2685, We ought to just burn these things.  Can't burn the find of the century.,The Thing
206,0:44:50,0:44:53,2690,That's gonna win somebody the Nobel Prize.,The Thing
207,0:45:6,0:45:8,2706,You got the keys?,The Thing
208,0:45:8,0:45:11,2708,Get them from Garry. I wanna get some stuff out of here.,The Thing
209,0:45:45,0:45:47,2745,There's something wrong with Blair.,The Thing
210,0:45:47,0:45:50,2747,"He's locked himself in his room, and he won't answer the door.",The Thing
211,0:45:50,0:45:52,2750,So I took one of his notebooks from the lab.,The Thing
212,0:45:52,0:45:54,2752, Yeah?  Listen.,The Thing
213,0:45:56,0:45:59,2756,"""It could have imitated a million lifeforms on a million planets.",The Thing
214,0:45:59,0:46:2,2759,"""Could change into any one of them at any time.",The Thing
215,0:46:2,0:46:3,2762,"""Now it wants lifeforms on Earth.""",The Thing
216,0:46:3,0:46:5,2763,"It's getting cold in here, and I haven't slept in days.",The Thing
217,0:46:5,0:46:6,2765,Wait.,The Thing
218,0:46:6,0:46:10,2766,"""It needs to be alone and in close proximity with a lifeform to be absorbed.",The Thing
219,0:46:10,0:46:12,2770,"""The chameleon strikes in the dark.""",The Thing
220,0:46:12,0:46:14,2772," So is Blair cracking up, or what?  Damn it, MacReady.",The Thing
221,0:46:14,0:46:17,2774,"""There is still cellular activity in these burned remains.",The Thing
222,0:46:17,0:46:19,2777,"""They're not dead yet.""",The Thing
223,0:46:30,0:46:33,2790,"Let's go, Bennings. I gotta get some sleep.",The Thing
224,0:46:52,0:46:54,2812,Holy shit.,The Thing
225,0:46:59,0:47:1,2819,Go get the doc.,The Thing
226,0:47:2,0:47:5,2822,I'll get Garry. We'll meet in Blair's room.,The Thing
227,0:47:11,0:47:13,2831,It's Bennings!,The Thing
228,0:47:23,0:47:26,2843,"Bennings was right there. Mac, I swear to God. It had a hold of him.",The Thing
229,0:47:39,0:47:42,2859,Windows! Windows! Keep away from him!,The Thing
230,0:47:45,0:47:47,2865,Get back! Stay back!,The Thing
231,0:47:51,0:47:53,2871,It isn't Bennings.,The Thing
232,0:48:26,0:48:28,2906,"My God, what was happening to him?",The Thing
233,0:48:28,0:48:31,2908,"If it had more time it would have looked, sounded and acted like Bennings.",The Thing
234,0:48:31,0:48:33,2911,I don't know what you're saying.,The Thing
235,0:48:33,0:48:37,2913,"That was one of those things out there trying to imitate him, Garry.",The Thing
236,0:48:41,0:48:43,2921," Come on.  MacReady, I know Bennings.",The Thing
237,0:48:43,0:48:46,2923,I've known him for 10 years. He's my friend.,The Thing
238,0:48:48,0:48:50,2928,We've gotta burn the rest of them.,The Thing
239,0:49:24,0:49:26,2964,"All right, step back.",The Thing
240,0:49:51,0:49:53,2991,You sure that's all of them?,The Thing
241,0:49:53,0:49:57,2993,"We cleaned out the storehouse, the lab. There is nothing left.",The Thing
242,0:49:58,0:50:0,2998,Where's Blair?,The Thing
243,0:50:42,0:50:43,3042,I can't find Blair.,The Thing
244,0:50:44,0:50:46,3044,Where's everybody else?,The Thing
245,0:50:46,0:50:48,3046,Windows is in the radio room still trying to get through.,The Thing
246,0:50:48,0:50:50,3048,Everyone else is in the rec room.,The Thing
247,0:50:51,0:50:53,3051,"Well, you go on. I'll be in in a minute.",The Thing
248,0:51:17,0:51:18,3077,Blair?,The Thing
249,0:51:20,0:51:21,3080,Blair?,The Thing
250,0:52:20,0:52:23,3140,Don't! You son of a bitch. You understand me?,The Thing
251,0:52:24,0:52:27,3144," He's got a gun. Get back.  Anybody interferes, I'll kill them.",The Thing
252,0:52:27,0:52:29,3147, Jesus.  Just leave it here. We're gonna talk.,The Thing
253,0:52:29,0:52:30,3149,He smashed up some of the chopper pretty good.,The Thing
254,0:52:30,0:52:32,3150,Nobody talk to nobody!,The Thing
255,0:52:32,0:52:34,3152,"Childs, go see if he got to the tractor.",The Thing
256,0:52:35,0:52:39,3155,Nobody gets in and out of here. Nobody.,The Thing
257,0:52:44,0:52:49,3164,"You guys think I'm crazy. Well, that's fine.",The Thing
258,0:52:50,0:52:53,3170,Most of you don't know what's going on around here.,The Thing
259,0:52:53,0:52:57,3173,"Well, I'm damn well sure some of you do.",The Thing
260,0:52:58,0:52:59,3178,Christ.,The Thing
261,0:53:3,0:53:6,3183,"He got most of the chopper and the tractor, and he's killed the rest of the dogs.",The Thing
262,0:53:10,0:53:12,3190,"Garry, wait a minute, wait a minute.",The Thing
263,0:53:13,0:53:17,3193,"Now, Childs, go around to the map room door. Talk to him.",The Thing
264,0:53:18,0:53:19,3198,Okay.,The Thing
265,0:53:20,0:53:22,3200,"Norris, get a table from the lab.",The Thing
266,0:53:25,0:53:28,3205,Do you think that thing wanted to be an animal?,The Thing
267,0:53:28,0:53:31,3208,No dogs make it a thousand miles through the cold.,The Thing
268,0:53:35,0:53:37,3215,"Nah, you don't understand!",The Thing
269,0:53:38,0:53:40,3218,That thing wanted to be us.,The Thing
270,0:53:41,0:53:43,3221,If the cell gets out,The Thing
271,0:53:43,0:53:45,3223,it could imitate everything on the face of the earth,The Thing
272,0:53:46,0:53:48,3226," and it's not gonna stop!  Okay, Blair.",The Thing
273,0:53:49,0:53:52,3229,"Come on, man, you don't wanna hurt anybody.",The Thing
274,0:53:52,0:53:54,3232,I'll kill you.,The Thing
275,0:54:20,0:54:22,3260,"Good shot, MacReady.",The Thing
276,0:54:22,0:54:23,3262, Excuse me.  Okay.,The Thing
277,0:54:23,0:54:25,3263," All right, bring him up.  Yeah.",The Thing
278,0:54:46,0:54:47,3286,"Come on, Blair.",The Thing
279,0:54:53,0:54:55,3293,What about your shack?,The Thing
280,0:54:55,0:54:58,3295,I don't want him in my shack. We'll lock him in the toolshed.,The Thing
281,0:55:2,0:55:6,3302," Why am I in here?  For your own protection, Blair.",The Thing
282,0:55:21,0:55:23,3321,"How you doing, old boy?",The Thing
283,0:55:27,0:55:29,3327,I don't know who to trust.,The Thing
284,0:55:30,0:55:33,3330,"I know what you mean, Blair.",The Thing
285,0:55:34,0:55:37,3334,Trust's a tough thing to come by these days.,The Thing
286,0:55:39,0:55:42,3339,Tell you what. Why don't you just trust in the Lord?,The Thing
287,0:55:45,0:55:47,3345, Watch Clark.  What?,The Thing
288,0:55:49,0:55:52,3349,"I said, watch Clark.",The Thing
289,0:55:53,0:55:55,3353,And watch him close. Do you hear me?,The Thing
290,0:56:14,0:56:16,3374,And now the radio's gone.,The Thing
291,0:56:16,0:56:19,3376, And so are the choppers.  We're completely cut off.,The Thing
292,0:56:19,0:56:22,3379,"All we can do now is hole up 'til spring, wait for the rescue team.",The Thing
293,0:56:23,0:56:24,3383,"No, we don't wait.",The Thing
294,0:56:25,0:56:27,3385,Somebody in this camp ain't what he appears to be.,The Thing
295,0:56:27,0:56:31,3387,"Right now that may be one or two of us. By spring, it could be all of us.",The Thing
296,0:56:31,0:56:33,3391,So how do we know who's human?,The Thing
297,0:56:34,0:56:37,3394,"If I was an imitation, a perfect imitation,",The Thing
298,0:56:38,0:56:40,3398,how would you know if it was really me?,The Thing
299,0:56:46,0:56:48,3406,"Is there some kind of test, Doc?",The Thing
300,0:56:48,0:56:52,3408,"Well, yeah, possibly. I've been thinking about a blood serum test.",The Thing
301,0:56:52,0:56:54,3412,What's that?,The Thing
302,0:56:54,0:56:59,3414,"We could take a sample of each person's blood, mix it with uncontaminated blood.",The Thing
303,0:56:59,0:57:2,3419,"I suppose if there's a reaction, we'd know who isn't human.",The Thing
304,0:57:2,0:57:6,3422, We've got whole blood in storage.  Start working on it.,The Thing
305,0:57:7,0:57:8,3427,Keep an eye on Clark.,The Thing
306,0:57:9,0:57:11,3429,He was close to that dog.,The Thing
307,0:57:12,0:57:13,3432, Yeah.  Yeah.,The Thing
308,0:57:18,0:57:23,3438,"Mac, we need Blair's help. He's the only one who knows this organism.",The Thing
309,0:57:23,0:57:24,3443,He's too far gone.,The Thing
310,0:57:24,0:57:27,3444,But get the rest of his notebooks. Start going through them.,The Thing
311,0:57:40,0:57:42,3460,"Garry! Hey, you guys, come here!",The Thing
312,0:57:45,0:57:47,3465, What?  Somebody got to the blood.,The Thing
313,0:57:48,0:57:49,3468,What?,The Thing
314,0:57:49,0:57:51,3469, Where's Clark?  Right here.,The Thing
315,0:57:52,0:57:56,3472, Wait a minute. Was this broken into?  The lock is undamaged.,The Thing
316,0:57:56,0:57:58,3476,"Somebody opened it, closed it, then locked it.",The Thing
317,0:57:58,0:57:59,3478,Great.,The Thing
318,0:57:59,0:58:1,3479,Who's got access to it?,The Thing
319,0:58:6,0:58:8,3486,I guess I'm the only one.,The Thing
320,0:58:8,0:58:10,3488,And I got the only key.,The Thing
321,0:58:14,0:58:18,3494," Would that test have worked, Doc?  I think so, yes.",The Thing
322,0:58:18,0:58:20,3498,Somebody else sure as hell thought so.,The Thing
323,0:58:20,0:58:23,3500,"Well, who else could've used that key?",The Thing
324,0:58:23,0:58:27,3503,Nobody! I just give it to Copper whenever he needs it.,The Thing
325,0:58:27,0:58:30,3507,"Could anybody have gotten it from you, Doc?",The Thing
326,0:58:30,0:58:34,3510,"I don't see how. As soon as I'm finished, I return it right away.",The Thing
327,0:58:35,0:58:36,3515,Great.,The Thing
328,0:58:38,0:58:42,3518, When was the last time you used it?  Day or so ago.,The Thing
329,0:58:43,0:58:46,3523,I suppose somebody could have lifted it off me...,The Thing
330,0:58:46,0:58:47,3526,"Oh, come on!",The Thing
331,0:58:47,0:58:50,3527,That key ring of yours is always hooked to your belt.,The Thing
332,0:58:51,0:58:53,3531,Accusing everybody...,The Thing
333,0:58:54,0:58:55,3534,MacREADY: Stop it! It ain't worth it!,The Thing
334,0:58:55,0:58:57,3535,Copper's the only one who's got any business with it.,The Thing
335,0:58:57,0:59:0,3537,Wait a minute! You've been in here on several occasions.,The Thing
336,0:59:0,0:59:1,3540,Doc thought of the test.,The Thing
337,0:59:1,0:59:4,3541,So what? Is that supposed to clear him?,The Thing
338,0:59:5,0:59:8,3545, Windows!  Windows!,The Thing
339,0:59:20,0:59:22,3560,Put that down!,The Thing
340,0:59:22,0:59:25,3562, No.  I'll put this right through your head.,The Thing
341,0:59:27,0:59:29,3567,You guys gonna listen to Garry?,The Thing
342,0:59:29,0:59:32,3569,You gonna let him give the orders? He could be one of those things.,The Thing
343,0:59:32,0:59:33,3572,Windows.,The Thing
344,0:59:35,0:59:38,3575,Wait a minute. Just take it easy. Put the gun down.,The Thing
345,0:59:38,0:59:40,3578,Put it down. You don't want to hurt anybody.,The Thing
346,0:59:40,0:59:41,3580,Right.,The Thing
347,0:59:42,0:59:43,3582,On the floor.,The Thing
348,0:59:58,1:0:0,3598,It's on the floor.,The Thing
349,1:0:6,1:0:8,3606,"I don't know about Copper,",The Thing
